State,State Leg,Number,Status,Issues,Notes,Source Link,Year
Tennessee,Tennessee General Assembly,S.B.0672,Enacted,Mental Health Treatment,"Allows Tennessee advance practice nurses and physician assistants to make a preliminary determination of whether a person is suitable for emergency admission to treatment facilities for mental health issues, in order to share workload among qualified medical providers who are not doctors to allow doctors to focus their efforts where they are most needed, improving the efficiency and effectiveness of medical care for mental health patients.",http://wapp.capitol.tn.gov/apps/BillInfo/Default.aspx?BillNumber=SB0672&ga=113,2023
Tennessee,Tennessee General Assembly,S.B.0817,Enacted,ALOB,"Prevents Tennessee from imposing divisive concepts such as systemic or inherent racism, different treatment based on race or sex, and categorical guilt of certain racial groups, in the form of loyalty oaths, discrimination in hiring or promotion, or mandatory training or indoctrination. This will ensure freedom of thought and freedom from institutional discrimination for students, faculty, and staff.",http://wapp.capitol.tn.gov/apps/BillInfo/Default.aspx?BillNumber=SB0817&ga=113,2023
Tennessee,Tennessee General Assembly,H.B.1213,Enacted,Patient's Right to Save,"Allows Tennesseans to shop around for lower costs for treatment, and, if a covered person negotiates a lower cost for service than what their insurance would pay, that savings would be credited toward the patient's deductible, in order to incentivize patients and providers alike to reduce healthcare costs.",http://wapp.capitol.tn.gov/apps/BillInfo/Default.aspx?BillNumber=HB1213&ga=113,2023
Tennessee,Tennessee General Assembly,S.B.1437,Enacted,Regulatory Reform,"Removes the distance from home restrictions on Tennessee minors' motorcycle learner's permits if the minor is supervised by a parent or legal guardian also operating a motorcycle, reducing unnecessary regulatory burden while ensuring young riders are adequately supervised.",http://wapp.capitol.tn.gov/apps/BillInfo/Default.aspx?BillNumber=SB1437&ga=113,2023
Texas,Texas Legislature,S.B. 17,Enacted,ALOB,"Restricts DEI offices in Texas universities and prevents compelled DEI statements, trainings, or discrimination based on race, sex, color, ethnicity, or national origin, in order to ensure freedom of thought and freedom from institutional discrimination for students, faculty, and staff.",http://capitol.texas.gov/BillLookup/History.aspx?LegSess=88R&Bill=SB17,2023
Texas,Texas Legislature,H.B. 8,Enacted,Performance Based Funding,"Requires Texas higher education institutions to share detailed information on costs and job prospects of their programs, in order to ensure prospective students are armed with sufficient information to choose the program that will be best for their career aspirations.",http://capitol.texas.gov/BillLookup/History.aspx?LegSess=88R&Bill=HB8,2023
Texas,Texas Legislature,H.B. 1038,Enacted,Financial Transparency,"Introduces reporting requirements for state lending and credit support programs in Texas, in order to ensure transparency and accountability in those programs.",http://capitol.texas.gov/BillLookup/History.aspx?LegSess=88R&Bill=HB1038,2023
Utah,Utah State Legislature,H.B.159,Enacted,International Physicians,"Allows for healthcare providers in other states to provide telemedicine services in Utah under a temporary license, in order to alleviate physician shortages and make health care more accessible to Utah patients.",https://le.utah.gov/~2023/bills/static/HB0159.html,2023
Utah,Utah State Legislature,H.B.499,Enacted,Homelessness,"Overhauls Utah's homeless services strategy by requiring municipalities to enforce camping bans to receive funds, creates a winter response task force, and allocates funding to municipalities based on available shelter beds, in order to improve the quality and effectiveness of Utah's services for the homeless.",https://le.utah.gov/~2023/bills/static/HB0499.html,2023
Arizona,Arizona State Legislature,S.B.1262,Enacted,Financial Transparency,"Requires reporting on all bond issues and securities longer than a year, as well as on lending and credit support programs, in order to allow Arizona investors greater transparency on their investment options.",https://apps.azleg.gov/BillStatus/BillOverview/77154,2022
Arizona,Arizona State Legislature,H.B.2731,Enacted,Sandbox,"Expands the regulatory sandbox program, which allows Arizona businesses to test innovative products and services without the normal licensing requirements with limited market access, by allowing a broader range of products to be included in the program. It does this in order to foster innovation by providing a controlled environment for businesses to demonstrate new offerings without the immediate burden of full regulatory compliance.",https://apps.azleg.gov/BillStatus/BillOverview/77796,2022
Arizona,Arizona State Legislature,H.B.2612,Enacted,Licensure,"Reforms Arizona's occupational licensing laws, making it easier to transfer licenses without fees in industries like real estate, healthcare, liquor, and lottery sales, in order to reduce regulations and allow for more innovation with less red tape.",https://apps.azleg.gov/BillStatus/BillOverview/77325,2022
Florida,Florida Legislature,C.S./C.S./S.B. 752,Enacted,Probation and Parole,"Includes several reforms to probation in Florida, including allowing probationers to report in remotely and incentives for educational advancement, in order to ease the return of those on probation back into society and to reduce recidivism.",http://flsenate.gov/Session/Bill/2022/752,2022
Florida,Florida Legislature,S.B. 7044,Enacted,Education,"Allows Florida to perform post-tenure reviews of state university faculty, mandates transparency in tuition and fees, requires detailed syllabi and course lists to be published, and allows flexibility in choosing an accreditation agency, in order to increase transparency and reduce costs for Florida students.",http://flsenate.gov/Session/Bill/2022/7044,2022
Tennessee,Tennessee General Assembly,H.B.0978,Enacted,Camping Bans,"Bans camping on public property around highways in Tennessee, in order to reduce the dangers associated with homeless encampments, including drug use, violence, litter, and other nuisances.",http://wapp.capitol.tn.gov/apps/BillInfo/Default.aspx?BillNumber=HB0978&ga=112,2022
Utah,Utah State Legislature,S.B.43,Enacted,Licensure,"Eases occupational licensing requirements on several fields in Utah, including speech-language pathology, environmental health science, and cosmetology, in order to reduce regulatory burdens and encourage innovation and competition in licensed fields.",https://le.utah.gov/~2022/bills/static/SB0043.html,2022
Utah,Utah State Legislature,H.B.363,Enacted,Mental Health Treatment,"Extends civil commitment powers in Utah, including extending the maximum period for temporary civil commitment, allows mental health evaluations via telehealth, and gives courts flexibility for ordering commitment, outpatient treatment, or dismissal, in order to ensure cases of acute mental health crisis are given appropriate treatment.",https://le.utah.gov/~2022/bills/static/HB0363.html,2022
Utah,Utah State Legislature,H.B.412,Enacted,Probation and Parole,"Creates a probation and parole employment incentive program in Utah, in order to enhance employment outcomes for individuals on parole and felony probation, thereby reducing recidivism.",https://le.utah.gov/~2022/bills/static/HB0412.html,2022
Utah,Utah State Legislature,H.B.440,Enacted,Homelessness,Creates a new homeless network steering committee in Utah and changes the funding formula to direct funding to support homeless services in a more cost-effective manner. It also restricts funding for municipalities that do not enforce camping bans to ensure accountability.,https://le.utah.gov/~2022/bills/static/HB0440.html,2022
Wisconsin,Wisconsin State Legislature,S.B.606,Enacted,Financial Transparency,"Introduces new publishing and reporting requirements for the state's transportation infrastructure loan program, in order to increase transparency and ensure funds are being spent appropriately.",https://docs.legis.wisconsin.gov/2021/proposals/reg/sen/bill/sb606,2022
Arizona,Arizona State Legislature,H.B.2168,Enacted,Public Safety,"Requires law enforcement agencies to collect and report data on use-of-force incidents involving their officers, in order to increase transparency and public oversight of police actions.",https://apps.azleg.gov/BillStatus/BillOverview/74592,2021
Arizona,Arizona State Legislature,H.B.2787,Enacted,Probation and Parole,"Redefines ""moral turpitude"" in Arizona law in a way to allow some individuals with criminal records to still be able to obtain occupational licenses, in order to increase opportunities for reformed former criminals, to reduce regulation, and to further competition and innovation.",https://apps.azleg.gov/BillStatus/BillOverview/75980,2021
Florida,Florida Legislature,H.B. 7051,Enacted,Public Safety,"Reforms law enforcement hiring practices in Florida to require disclosure of any past resignations, detailed reasons for separations from previous employment, and new training in use of proportional force and deescalation techniques, in order to reduce unnecessary use of force by law enforcement and ensure citizens are properly protected.",http://flsenate.gov/Session/Bill/2021/7051,2021
Florida,Florida Legislature,C.S./C.S./C.S./H.B. 1507,Enacted,Education,"Creates an Office of Reimagining Education and Career Help in the office of the Florida governor and creates several other programs including tuition assistance for workforce training and tuition reimbursement if a student fails to find a job in his/her trained field, in order to more directly align education with positive career outcomes.",http://flsenate.gov/Session/Bill/2021/1507,2021
Georgia,Georgia General Assembly,H.B.591,Enacted,Mental Health Treatment,"Expands the scope of professionals who can conduct emergency mental illness or substance abuse evaluations in Georgia to include marriage and family therapists, psychologists, clinical social workers, licensed professional counselors, and clinical nurse specialists can perform these tasks in lieu of physicians, freeing up some demands on physicians' time and ensuring that patients in need can be seen as quickly as possible.",https://www.legis.ga.gov/legislation/59958,2021
Missouri,Missouri General Assembly,S.B. 53,Enacted,Public Safety,"A major reform of Missouri criminal law practices, which among other provisions includes requirements for use of force training, enhanced background checks, prohibitions on chokeholds, and providing stress management programs for law enforcement. It also creates a database of police use of force incidents, all in order to provide transparency and accountability for law enforcement and to ensure citizens are receiving proper protection.",http://www.senate.mo.gov/21info/BTS_Web/Bill.aspx?SessionType=R&BillID=54105455,2021
North Carolina,North Carolina General Assembly,S300,Enacted,Public Safety,"A major reform of North Carolina criminal law practices, which among other provisions includes increases in protections, training, and oversight for law enforcement, focused on reducing excessive use of force and using body cameras, in order to provide transparency and accountability for law enforcement and to ensure citizens are receiving proper protection.",https://www.ncleg.gov/BillLookUp/2021/S300,2021
Tennessee,Tennessee General Assembly,S.B.1380,Enacted,Public Safety,"Prohibits the use of choke holds by Tennessee law enforcement and requires training in deescalation, in order to increase accountability for law enforcement and ensure citizens' rights are protected.",http://wapp.capitol.tn.gov/apps/BillInfo/Default.aspx?BillNumber=SB1380&ga=112,2021
Texas,Texas Legislature,H.B. 1925,Enacted,Camping Bans,"Bans public camping in Texas. This will ensure that homeless people are off the streets and connected with the resources they need, which will help make Texas communities cleaner and safer.",http://capitol.texas.gov/BillLookup/History.aspx?LegSess=87R&Bill=HB1925,2021
Wisconsin,Wisconsin State Legislature,S.B.123,Enacted,Public Safety,"Requires collection of data on use-of-force incidents by Wisconsin law enforcement, in order to increase transparency and accountability for law enforcement to ensure citizens are receiving proper protection.",https://docs.legis.wisconsin.gov/2021/proposals/reg/sen/bill/sb123,2021
