State,State Leg,Number,Status,Issues,Notes,Source Link,Year
Wyoming,Wyoming State Legislature,S.F.0079,Enacted,Venue Restriction,"Provides for venue change for incorrect court venues in Wyoming, which can be done either by the court or by motion of either party. This ensures greater ease of access to petitioners not in a state capital's jurisdiction and potentially allows for fairer trials with more representative jury pools.",http://legisweb.state.wy.us/Legislation/2025/SF0079,2025
Wyoming,Wyoming State Legislature,S.F.0086,Enacted,Teacher Competency,"Allows alternative certification methods for teachers, enabling alternative pathways to addressing teacher shortages and increasing access to and quality of education for Wyoming students.",http://legisweb.state.wy.us/Legislation/2025/SF0086,2025
Wyoming,Wyoming State Legislature,S.F.0107,Enacted,Licensure,"A full ban on noncompete agreements, with exceptions for senior leadership and trade secrets. It bans future and voids current noncompete clauses, which will benefit physicians currently covered by noncompete agreements and increase access to quality health care for the people of Wyoming.",http://legisweb.state.wy.us/Legislation/2025/SF0107,2025
Wyoming,Wyoming State Legislature,S.F.0127,Enacted,Independent Review,"A major regulatory reform package, which includes provisions for cost-benefit analysis and 5-year sunsets of regulations, and the REINS act. Its passage, over the governor's veto, will significantly increase efficiency and legislative accountability in the Wyoming regulatory process.",http://legisweb.state.wy.us/Legislation/2025/SF0127,2025
Texas,Texas Legislature,H.B. 24,Sent to Governor,Regulatory Reform,"Revises the procedures for Texas local governments to change their zoning codes, making the notification requirements less burdensome. It also introduces a presumption of validity for zoning changes, enabling municipalities to automatically be able to enact zoning changes if not legally challenged, in order to allow Texas to address its housing shortages more efficiently and effectively.",https://capitol.texas.gov/BillLookup/History.aspx?LegSess=89R&Bill=HB24,2025
Nevada,Nevada Legislature,A.B. 547,Enacted,Degree Requirements,"Limits the requirements of postsecondary degrees for state jobs in Nevada unless absolutely necessary and allows applicants to show alternative qualifications such as relevant work experience or non-degree credentials, in order to broaden the pool of qualified candidates and allow open positions to be filled more quickly and efficiently.",https://www.leg.state.nv.us/App/NELIS/REL/83rd2025/Bill/12854/Overview,2025
Oregon,Oregon Legislative Assembly,H.B. 2540,Enacted,Patients Right to Save,Requires health insurers to credit any amount an enrollee pays directly to a provider toward out-of-pocket costs and deductibles in Oregon. This incentivizes patients and providers alike to find ways to lower healthcare costs.,https://olis.oregonlegislature.gov/liz/2025R1/Measures/Overview/HB2540,2025
Arizona,Arizona State Legislature,H.B.2490,Enacted,Venue Restriction,"Allows a party appealing a final administrative decision in Arizona to choose any proper venue, rather than being limited to a court in the state capital, in order to reduce the institutional advantages bureaucracies can have when defending their decisions on their home turf and give more decisionmaking power to people in outer areas of the state who may be more adversely affected by agency policies.",https://apps.azleg.gov/BillStatus/BillOverview/80354,2024
Arizona,Arizona State Legislature,S.B.1402,Enacted,Patient's Right to Save,"Allows health insurers to create savings incentive programs for patients in Arizona who find prices for their treatment that is below the insurer's usual rates, granting them reimbursement for a portion of the difference. This incentivizes patients and providers alike to find ways to lower healthcare costs.",https://apps.azleg.gov/BillStatus/BillOverview/80925,2024
Colorado,Colorado General Assembly,SB24-141,Enacted,Telehealth,"Allows out-of-state healthcare providers to offer telehealth services to Colorado patients, in order to increase availability and reduce costs of healthcare in Colorado.",http://leg.colorado.gov/bills/sb24-141,2024
Florida,Florida Legislature,H.B. 7089,Enacted,Hospital Price Transparency; Patient's Right to Save,"Introduces requirements for medical facilities to post their prices in order to enable patients to shop around for the lowest prices, and adds a statute of limitations for collecting medical debt.",http://flsenate.gov/Session/Bill/2024/7089,2024
Florida,Florida Legislature,C.S./S.B. 7016,Enacted,Electronic Health Records; International Physicians,"A major healthcare reform in Florida, with many components; items of interest include expanding loan reimbursement to a wider range of healthcare practitioners such as dental hygienists; providing for telehealth for maternity care statewide; and increasing recognition of licenses from other states, in order to increase availability of medical providers in Florida.",http://flsenate.gov/Session/Bill/2024/7016,2024
Florida,Florida Legislature,S.B. 7018,Enacted,Healthcare; International Physicians,Creates a Health Care Innovation Council in the Florida Department of Health to explore new ideas for improving access and affordability of health care in the state.,http://flsenate.gov/Session/Bill/2024/7018,2024
Florida,Florida Legislature,C.S./C.S./H.B. 1365,Enacted,Camping Bans; Homelessness; Local Accountability; Mental Health Treatment; Sanctioned Camping Sites,"Prohibits Florida counties and municipalities from allowing unauthorized camping except in designated areas and allows residents, business owners, or the Attorney General to sue local governments that do not comply, in order to ensure that homeless people are off the streets and connected with the resources they need, which will help make Florida's communities cleaner and safer.",http://flsenate.gov/Session/Bill/2024/1365,2024
Georgia,Georgia General Assembly,H.B.1410,Enacted,Drug-free Homeless Service Zones; Homelessness; Mental Health Treatment,"Establishes a state housing accountability program in Georgia, with an application process and requirements for job training and substance abuse treatment, and also includes oversight for how funds are being spent, in order to both provide needed services for homeless Georgians and also ensure public funds are being spent effectively.",https://www.legis.ga.gov/legislation/67457,2024
Idaho,Idaho State Legislature,H.626,Enacted,Regulatory Reform,"Instructs Idaho courts not to defer to agencies' interpretations of administrative rules, which will increase the ability of the legislature and courts to set regulatory policy in the face of potential opposition from the bureaucracy.",https://legislature.idaho.gov/sessioninfo/2024/legislation/H0626,2024
Idaho,Idaho State Legislature,H.542,Enacted,International Physicians,"Allows internationally licensed physicians to practice in Idaho, with a special focus on rural and primary care settings, in order to increase accessibility of care in underserved regions.",https://legislature.idaho.gov/sessioninfo/2024/legislation/H0542,2024
Idaho,Idaho State Legislature,H.563,Enacted,Independent Review,"Requires a periodic review of Idaho administrative rules every eight years, with agencies reporting on the necessity of their rules to the legislature and considering whether the rules' content should be moved into statute, in order to better ensure Idaho administrative rules are necessary and beneficial for the citizens.",https://legislature.idaho.gov/sessioninfo/2024/legislation/H0563,2024
Idaho,Idaho State Legislature,H.433,Enacted,Degree Requirements,"Limits the requirements of postsecondary degrees for state jobs in Idaho unless absolutely necessary and allows applicants to show alternative qualifications such as relevant work experience or non-degree credentials, in order to broaden the pool of qualified candidates and allow open positions to be filled more quickly and efficiently.",https://legislature.idaho.gov/sessioninfo/2024/legislation/H0433,2024
Idaho,Idaho State Legislature,H.436,Enacted,Licensure,"Creates the Idaho Allied Health Advisory Board, which will give guidance to the Idaho Board of Medicine on licensing of various types of health professionals, including dietitians, athletic trainers, and naturopathic practitioners, consolidating several previously existing boards into one. This will reduce administrative complexity and streamline licensing procedures for Idaho medical practitioners.",https://legislature.idaho.gov/sessioninfo/2024/legislation/H0436,2024
Idaho,Idaho State Legislature,H.490,Enacted,Healthcare,"Requires applicants for various licenses in Idaho, including nursing, pharmacy, medicine, real estate, counseling, and driving instruction, be required to go through criminal background checks with fingerprinting, in order to enhance public safety when interacting with licensed professionals.",https://legislature.idaho.gov/sessioninfo/2024/legislation/H0490,2024
Iowa,Iowa General Assembly,S.F.477,Enacted,International Physicians,"Allows internationally-trained physicians to practice in Iowa under a provisional license if they meet requirements including examination, background check, residency and five years' practice abroad, and good standing with their home country medical board, in order to address physician shortages in the state. It also ensures minors' electronic health information will be made available to their parents.",https://www.legis.iowa.gov/legislation/BillBook?ba=SF477&ga=90,2024
Kansas,Kansas State Legislature,H.B.2648,Enacted,Regulatory Reform,"Requires any proposed rule or regulation in Kansas that is expected to incur over $1 million in implementation and compliance costs in the first five years must be ratified by the legislature before it can go into effect, in order to increase oversight and reduce costs for Kansas taxpayers.",http://www.kslegislature.org/li/b2023_24/measures/hb2648/,2024
Kansas,Kansas State Legislature,H.B.2353,Enacted,Mental Health Treatment,"Extends the time for involuntary commitments in Kansas, creates safeguards regarding the need for a written statement from a qualified mental health professional for detention at state psychiatric hospitals, and prohibiting detention in jails or prisons, in order to both allow greater use of involuntary commitment for acute mental health issues while protecting the rights and wellbeing of those involuntarily committed.",http://www.kslegislature.org/li/b2023_24/measures/hb2353/,2024
Kentucky,Kentucky General Assembly,H.B.5,Enacted,Camping Bans; Homelessness; Mental Health Treatment; Public Safety; Sanctioned Camping Sites,"A major overhaul of Kentucky's criminal statutes, and among many other provisions includes a ban on unsanctioned homeless camping, in order to reduce the dangers associated with homeless encampments, including drug use, violence, litter, and other nuisances.",https://apps.legislature.ky.gov/record/24rs/hb5.html,2024
Louisiana,Louisiana Legislature,H.B.566,Enacted,Degree Requirements,"Removes unnecessary degree requirements from state jobs in Louisiana, in order to broaden the pool of eligible candidates to those without degrees but with relevant experience, allow more access to state employment, and allow open positions to be filled more efficiently.",https://www.legis.la.gov/legis/BillInfo.aspx?s=24RS&b=HB566,2024
Louisiana,Louisiana Legislature,H.B.904,Enacted,ALOB,"Requires public schools, colleges, and universities to report on their DEI programs, in order to increase transparency on potentially discriminatory DEI practices.",https://www.legis.la.gov/legis/BillInfo.aspx?s=24RS&b=HB904,2024
Louisiana,Louisiana Legislature,H.B.972,Enacted,International Physicians,"Allows internationally-trained physicians to practice medicine in Louisiana as long as they are properly trained and in good standing in their home country, fluent in English, and have secured employment in a Louisiana hospital, in order to address physician shortages and make medical care more available in the state.",https://www.legis.la.gov/legis/BillInfo.aspx?s=24RS&b=HB972,2024
Louisiana,Louisiana Legislature,H.B.716,Enacted,Licensure,"Makes recognition of out-of-state occupational licenses easier for professionals moving into Louisiana, removing regulatory barriers and increasing the availability of services.",https://www.legis.la.gov/legis/BillInfo.aspx?s=24RS&b=HB716,2024
Louisiana,Louisiana Legislature,S.B.332,Enacted,Licensure,"Repeals the Louisiana Occupational Licensing Review Commission, which will reduce regulatory hurdles to innovation and small business in Louisiana.",https://www.legis.la.gov/legis/BillInfo.aspx?s=24RS&b=SB332,2024
Louisiana,Louisiana Legislature,S.B.60,Enacted,Licensure,"Makes recognition of out-of-state occupational licenses easier for professionals moving into Louisiana, removing regulatory barriers and increasing the availability of services.",https://www.legis.la.gov/legis/BillInfo.aspx?s=24RS&b=SB60,2024
Louisiana,Louisiana Legislature,S.B.231,Enacted,Mental Health Treatment,"Expands the ability of Louisiana to use involuntary outpatient mental health treatment, with flexibility in treatment models and safeguards for the patients' rights, in order to make it easier to ensure mentally ill people receive the treatment they need.",https://www.legis.la.gov/legis/BillInfo.aspx?s=24RS&b=SB231,2024
Missouri,Missouri General Assembly,S.B. 894,Enacted,Sandbox,"Includes regulatory sandbox provisions which allow Missouri businesses to test innovative products and services under a temporary waiver of certain state regulations, in order to foster innovation by providing a controlled environment for businesses to demonstrate new offerings without the immediate burden of full regulatory compliance.",http://www.senate.mo.gov/24info/BTS_Web/Bill.aspx?SessionType=R&BillID=1558,2024
Ohio,Ohio General Assembly,H.B.33,Enacted,Degree Requirements,"Includes, among many other budgetary provisions, a requirement that Ohio cease to require four-year degrees for hiring unless strictly necessary, with an eye to expanding employment opportunities to Ohioans with relevant experience but without degrees, and allowing open positions to be filled more efficiently.",https://www.legislature.ohio.gov/legislation/135/hb33,2024
Oklahoma,Oklahoma Legislature,S.B.1854,Enacted,Homelessness,"Prohibits unauthorized camping in Oklahoma and allows law enforcement to issue a warning along with transportation to shelters or food pantries for first offenses. This will ensure that homeless people are off the streets and connected with the resources they need, which will help make Oklahoma communities cleaner and safer.",http://www.oklegislature.gov/BillInfo.aspx?Bill=SB1854&Session=2400,2024
South Carolina,South Carolina Legislature,H.B.4159,Enacted,Telehealth,Allows out-of-state advanced practice nurses and physician assistants to provide telehealth and telemedicine services in South Carolina in order to alleviate physician shortages and make nursing care more accessible.,https://www.scstatehouse.gov/billsearch.php?billnumbers=4159&session=125&summary=B,2024
Tennessee,Tennessee General Assembly,S.B.1881,Enacted,Telehealth,"Updates the requirements for telemedicine, ensuring that Tennessee patients have access to the highest quality care and their personal data is protected when interacting in a telehealth environment.",http://wapp.capitol.tn.gov/apps/BillInfo/Default.aspx?BillNumber=SB1881&ga=113,2024
Tennessee,Tennessee General Assembly,S.B.2012,Enacted,Electronic Health Records,"Requires medical providers in Tennessee to prevent healthcare professionals and associated businesses from blocking information from patients, with exception for sensitive test results, in order to ensure patients are able to access their health records easily and electronically.",http://wapp.capitol.tn.gov/apps/BillInfo/Default.aspx?BillNumber=SB2012&ga=113,2024
Tennessee,Tennessee General Assembly,H.B.2900,Enacted,International Physicians,"Requires Tennessee state and local government entities verify the citizenship or lawful residency status of any individual applying for public benefits, in order to verify that benefits are only going to the correct recipients, and allows for international physicians to more easily convert their provisional licenses into full licenses in order to increase availability of physicians in the state.",http://wapp.capitol.tn.gov/apps/BillInfo/Default.aspx?BillNumber=HB2900&ga=113,2024
Tennessee,Tennessee General Assembly,S.B.2689,Enacted,Public Safety,"Creates a centralized system for case management, document management, electronic case filing, electronic payment methods, and data reporting for all state and local courts in Tennessee, in order to increase efficiency and decrease costs.",http://wapp.capitol.tn.gov/apps/BillInfo/Default.aspx?BillNumber=SB2689&ga=113,2024
Utah,Utah State Legislature,S.B.213,Enacted,Probation and Parole,"Reforms Utah's criminal justice system and includes a provision whereby offenders can reduce their time on parole or probation by maintaining eligible employment, in order to ease the transition back into civilian life and reduce recidivism.",https://le.utah.gov/~2024/bills/static/SB0213.html,2024
Utah,Utah State Legislature,H.B.298,Enacted,Homelessness,"Reorganizes Utah's Homeless Services Board and expands its responsibilities to include more data reporting and setting more ambitious goals to reduce homelessness, and requires Utah municipalities to enforce camping bans to receive state funds, in order to better address challenges associated with the homeless population.",https://le.utah.gov/~2024/bills/static/HB0298.html,2024
Utah,Utah State Legislature,H.B.213,Enacted,Probation and Parole; WFT Credits,"Includes several crime record privacy provisions, and includes regulatory sandbox provisions which allow Utah businesses to test innovative products and services under a temporary waiver of certain state regulations, in order to foster innovation by providing a controlled environment for businesses to demonstrate new offerings without the immediate burden of full regulatory compliance.",https://le.utah.gov/~2024/bills/static/HB0213.html,2024
Utah,Utah State Legislature,S.B.109,Enacted,Probation and Parole,"Changes rules regarding probationers and parolees to more strongly punish violations, establishes a reentry program, and puts guardrails on when county jail officials can release individuals, in order to both properly punish crime and reduce recidivism.",https://le.utah.gov/~2024/bills/static/SB0109.html,2024
Virginia,Virginia General Assembly,H.B. 995,Enacted,International Physicians,"Allows foreign-trained physicians in Virginia to obtain a temporary license to practice if they trained at a WHO-recognized school and have practiced for at least five years, in order to increase the number of qualified doctors available to serve Virginia patients.",https://lis.virginia.gov/bill-details/20241/HB995,2024
Wisconsin,Wisconsin State Legislature,A.B.954,Enacted,International Physicians,"Allows internationally trained physicians to practice in Wisconsin if they have an offer of full-time employment from a Wisconsin healthcare facility, in order to increase the number of qualified doctors available to serve Wisconsin patients.",https://docs.legis.wisconsin.gov/2023/proposals/reg/asm/bill/ab954,2024
Arizona,Arizona State Legislature,S.B.1720,Enacted,Homelessness,"Arizona's general appropriations act, includes a homeless service grant pilot which would emphasize access to services, work opportunities, and transitional housing, in order to reduce homelessness and more productively offer services to move homeless individuals out of homelessness.",https://apps.azleg.gov/BillStatus/BillOverview/79724,2023
Arizona,Arizona State Legislature,H.B.2055,Enacted,WFT Credits,"Allows those on probation in Arizona to earn a time credit for employment they maintain, in order to help ease reintegration of offenders into society and reduce recidivism.",https://apps.azleg.gov/BillStatus/BillOverview/78135,2023
Arizona,Arizona State Legislature,S.B.1603,Enacted,Hospital Price Transparency,Introduces new requirements for hospital price transparency in Arizona which require health care facilities to disclose cash prices for their most used treatments. This will allow patients to more easily shop for the lowest prices for their procedures and reduce the cost of care overall.,https://apps.azleg.gov/BillStatus/BillOverview/79285,2023
Florida,Florida Legislature,C.S./C.S./S.B. 1310,Enacted,Degree Requirements,"Allows Florida public-sector employers to remove degree requirements in favor of work experience or other qualification, in order to broaden the pool of eligible candidates to those without degrees but with relevant experience, allow more access to state employment, and allow open positions to be filled more efficiently.",http://flsenate.gov/Session/Bill/2023/1310,2023
Florida,Florida Legislature,C.S./C.S./H.B. 931,Enacted,ALOB,"Requires Florida's college system to publish reports on intellectual freedom and viewport diversity in its institutions and bans political loyalty tests, in order to fight against DEI loyalty oaths and ensure true diversity of thought on Florida campuses.",http://flsenate.gov/Session/Bill/2023/931,2023
Georgia,Georgia General Assembly,S.B.3,Enacted,Degree Requirements,"Requires Georgia state agencies to evaluate their job postings and find places where degree requirements can be exchanged for alternative qualifications, in order to broaden the pool of eligible candidates to those without degrees but with relevant experience, allow more access to state employment, and allow open positions to be filled more efficiently.",https://www.legis.ga.gov/legislation/63492,2023
Georgia,Georgia General Assembly,S.B.62,Enacted,Homelessness,"Bans Georgia local governments from blocking the enforcement of camping bans, allows for diversion programs in lieu of arrest, and prohibits homeless people from being transported to other counties, in order to ensure that homeless people are off the streets and connected with the resources they need, which will help make Georgia's communities cleaner and safer.",https://www.legis.ga.gov/legislation/63809,2023
Idaho,Idaho State Legislature,H.61,Enacted,Telehealth,"Allows mental or behavioral health providers from other states to provide telehealth services in Idaho if in good standing in a jurisdiction with similar licensure requirements, in order to make mental health services more easily accessible for Idaho patients.",https://legislature.idaho.gov/sessioninfo/2023/legislation/H0061,2023
Idaho,Idaho State Legislature,S.1094,Enacted,International Physicians,"Allows for temporary licenses for international doctors to practice medicine in Idaho if they have completed residency and at least three years of experience in their home country and agree to work for at least three years in a designated health shortage area, in order to address physician shortages and make healthcare more accessible to Idahoans.",https://legislature.idaho.gov/sessioninfo/2023/legislation/S1094,2023
Idaho,Idaho State Legislature,H.162,Enacted,Telehealth,"Allows the establishment of a valid prescriber-patient relationship through telehealth in Idaho, in order to decrease cost and increase accessibility of medical care for Idaho patients.",https://legislature.idaho.gov/sessioninfo/2023/legislation/H0162,2023
Missouri,Missouri General Assembly,H.B. 417,Enacted,Degree Requirements,"Removes postsecondary degree requirements for state jobs unless absolutely necessary, and offers tax credits for the hiring of interns and apprentices, in order to increase the viability of non-college educational paths, allow more access to state employment, and allow open positions to be filled more efficiently.",http://www.house.mo.gov/BillContent.aspx?bill=HB417&year=2023&code=R%20,2023
Missouri,Missouri General Assembly,H.B. 131,Enacted,Regulatory Reform,"Allows the Missouri government to pay its employees in biweekly installments, instead of semimonthly or monthly, along with accountability measures, in order to grant the government more flexibility in making its disbursements.",http://www.house.mo.gov/BillContent.aspx?bill=HB131&year=2023&code=R%20,2023
Missouri,Missouri General Assembly,S.B. 111,Enacted,Degree Requirements,"Updates several provisions regarding state employees, including establishing regular reporting and uniform compensation, in order to increase efficiency in state spending in Missouri.",http://www.senate.mo.gov/23info/BTS_Web/Bill.aspx?SessionType=R&BillID=44527,2023
North Carolina,North Carolina General Assembly,H87,Enacted,Probation and Parole,"Allows North Carolina district attorneys to petition to modify probation terms in cases of either violation or good behavior, in order to ensure that those who are making progress can more easily return to society and that those likely to reoffend remain under supervision.",https://www.ncleg.gov/BillLookUp/2023/H87,2023
Tennessee,Tennessee General Assembly,S.B.1451,Enacted,International Physicians,"Allows international medical school graduates to receive a temporary license to practice in Tennessee, with possible transition to full licensure after two years in good standing, in order to alleviate physician shortages and increase access to care.",http://wapp.capitol.tn.gov/apps/BillInfo/Default.aspx?BillNumber=SB1451&ga=113,2023
